{
  "schema": "nx-cfw-evidence-v1",
  "schema_version": 1,
  "generated_note": "V3 CFW coverage catalog reconciled for base RC 699723e6e84ad7f50d16aeb98d94b6c9e3c9701b plus nxgenerator-v0.2.15 at 8d70b241722d2cec9ef78f9f68cb57cc91b38ae2. The Merchant physical candidate also pins nxgl 0.2.17 at f721af2cc657b3cbd24e8f64b0b61cf8b03aa762. Every claim is independent: nothing is grouped, inherited or copied between claims, and every missing proof is written down in gaps. Receipts are scoped to the exact scenarios and bytes they identify.",
  "claims": [
    {
      "id": "nextos-mali450-fbdev",
      "cfw": {
        "name": "NextOS",
        "version_or_build": "old-generation (Amlogic, Mali-450)",
        "origin": "official-image"
      },
      "hardware": {
        "vendor_model": "Amlogic Mali-450 test handheld",
        "soc": "Amlogic S905-family",
        "gpu_driver": "Mali-450 blob (fbdev)",
        "display_compositor": "none (fbdev direct)",
        "resolution": "1280x720 (measured in current receipt)",
        "orientation": "landscape"
      },
      "runtime": {
        "host_abi": "aarch64",
        "guest_abi": "aarch64 preferred, armv7 fallback",
        "libc": "glibc",
        "filesystem_semantics": "vfat game partition, case-insensitive",
        "ram_free": "about 916 MB total, fraction free varies"
      },
      "frontend": {
        "name": "EmulationStation (NextOS)",
        "portmaster_version": "unknown",
        "control_mapping_source": "PortMaster control.txt via frontend session"
      },
      "framework_ref": {
        "tag_or_commit": "framework-v3-rc2-20260827@699723e6 + nxgenerator@8d70b241 + nxgl@f721af2c",
        "components_note": "Merchant 09371aff, ZIP 341ddacde6384f76f16c233491d8735d25e5af5c72a81269414b85e9ba991700, generation 953db3e23ccde1134881d4fd3d2a940a2684dc4eaf4c30bbaa778e45742618b0"
      },
      "level": "physical-full",
      "scope": "exact Merchant physical run on NextOS Mali-450: clean extraction, graphical UI, timed splash runtime, game/fonts, GLES2 single-channel, audio backend, GPTK file load with A/B dispatch, clean exit, singleton and health-loss rollback; frontend click, pixel-valid splash capture, real GPTK profile swap, real process crash, rollback owner-state seal and isolated no-double-input are excluded",
      "scenarios": [
        "clean data extraction with NXE0000 and graphical NXExtract SDL",
        "timed NXSplash runtime and game image",
        "Mali-450 GLES2 luminance-alpha single-channel",
        "audio backend, GPTK file load and A/B dispatch",
        "clean exit and NXU0006",
        "single-instance refusal",
        "three missing health receipts followed by NXU0004 and NXU0006",
        "owner state restored outside the rollback subtest"
      ],
      "receipt": {
        "present": true,
        "sanitized_ref": "receipts/merchant-v3-nextos-mali450-20260827.json",
        "private_manifest_sha256": "e6e8cf20bcb3a6aae3ccaf364364acdf06016be60b184692e2cf6fcfc5a2212e"
      },
      "gaps": [
        "sem receipt de clique ou retorno pelo frontend porque EmulationStation estava mascarado",
        "sem receipt de instalacao limpa do ZIP pelo PortMaster nesta classe",
        "captura da NXExtract prova renderer SDL visivel, mas nao possui comparacao golden por pixels",
        "captura da NXSplash ficou preta; log e timing nao provam identidade visual por pixels",
        "SELECT+START teve aceite humano, mas nao foi selado como causa da saida no bundle",
        "rollback induzido por supressao do health receipt, nao por crash real do processo",
        "subteste de rollback nao selou saves, gamedata, GPTK e settings imediatamente antes e depois",
        "sem troca real do arquivo/perfil GPTK para inverter A e B",
        "sem sonda fisica isolada de ausencia de duplo input",
        "sem receipt de diretorio .update vazio depois do teste",
        "build exato da imagem NextOS nao foi identificado no bundle"
      ]
    },
    {
      "id": "nextos-x5-x5m-mali-g310-kmsdrm",
      "cfw": {
        "name": "NextOS",
        "version_or_build": "X5/X5M generation (Mali-G310, KMSDRM)",
        "origin": "official-image"
      },
      "hardware": {
        "vendor_model": "NextOS X5 / X5M",
        "soc": "unknown (G310-class platform)",
        "gpu_driver": "Mali-G310 (KMSDRM path)",
        "display_compositor": "KMSDRM",
        "resolution": "unknown",
        "orientation": "landscape"
      },
      "runtime": {
        "host_abi": "aarch64",
        "guest_abi": "aarch64",
        "libc": "glibc",
        "filesystem_semantics": "unknown",
        "ram_free": "unknown"
      },
      "frontend": {
        "name": "EmulationStation (NextOS)",
        "portmaster_version": "unknown",
        "control_mapping_source": "PortMaster control.txt via frontend session"
      },
      "framework_ref": {
        "tag_or_commit": "framework-v3-candidate",
        "components_note": "no dedicated V2 matrix profile exists for this stack"
      },
      "level": "community",
      "scope": "old validations of ports on the X5/X5M stack predate the V2 profile battery; only field-level confidence for this tag",
      "scenarios": [
        "historical port runs reported on X5/X5M outside the V2 profile battery"
      ],
      "receipt": {
        "present": false,
        "sanitized_ref": null,
        "private_manifest_sha256": null
      },
      "gaps": [
        "criar perfil V3 proprio para o stack G310/KMSDRM; nunca reaproveitar evidencia do Mali-450",
        "receipt exato ausente nesta tag"
      ]
    },
    {
      "id": "emuelec-generic",
      "cfw": {
        "name": "EmuELEC",
        "version_or_build": "unknown",
        "origin": "none"
      },
      "hardware": {
        "vendor_model": "unknown",
        "soc": "unknown",
        "gpu_driver": "unknown",
        "display_compositor": "unknown",
        "resolution": "unknown",
        "orientation": "unknown"
      },
      "runtime": {
        "host_abi": "unknown",
        "guest_abi": "unknown",
        "libc": "unknown",
        "filesystem_semantics": "unknown",
        "ram_free": "unknown"
      },
      "frontend": {
        "name": "EmulationStation (EmuELEC)",
        "portmaster_version": "unknown",
        "control_mapping_source": "unknown"
      },
      "framework_ref": {
        "tag_or_commit": "framework-v3-candidate",
        "components_note": "no EmuELEC profile exists in the matrix"
      },
      "level": "design-only",
      "scope": "no dedicated profile: only design intent that the launcher contract should work on EmuELEC",
      "scenarios": [],
      "receipt": {
        "present": false,
        "sanitized_ref": null,
        "private_manifest_sha256": null
      },
      "gaps": [
        "criar perfil proprio (roots, deteccao, provider grafico) antes de qualquer promessa",
        "nenhuma imagem oficial lida para este stack"
      ]
    },
    {
      "id": "arkos-rk3326-mali-g31",
      "cfw": {
        "name": "ArkOS",
        "version_or_build": "RK3326 line (historical physical runs)",
        "origin": "official-image"
      },
      "hardware": {
        "vendor_model": "R36S-class RK3326 handheld",
        "soc": "Rockchip RK3326",
        "gpu_driver": "Mali-G31 (KMSDRM path)",
        "display_compositor": "KMSDRM",
        "resolution": "640x480",
        "orientation": "landscape"
      },
      "runtime": {
        "host_abi": "aarch64",
        "guest_abi": "aarch64 and armv7",
        "libc": "glibc",
        "filesystem_semantics": "vfat roms partition, case-insensitive",
        "ram_free": "unknown"
      },
      "frontend": {
        "name": "EmulationStation (ArkOS)",
        "portmaster_version": "unknown",
        "control_mapping_source": "PortMaster control.txt"
      },
      "framework_ref": {
        "tag_or_commit": "framework-v3-candidate",
        "components_note": "V2 profile arkos exercises the launcher contract with a synthetic automatic fixture"
      },
      "level": "physical-full",
      "scope": "historical full physical validation on RK3326/ArkOS; the repeatable harness for this tag is the synthetic automatic fixture, not the real frontend",
      "scenarios": [
        "boot-to-gameplay via ES (historical)",
        "audio output (historical)",
        "physical controls (historical)",
        "synthetic launcher-contract fixture replay (this tag)"
      ],
      "receipt": {
        "present": false,
        "sanitized_ref": null,
        "private_manifest_sha256": null
      },
      "gaps": [
        "receipt fisico exato ausente nesta tag: apenas a fixture sintetica e replayavel hoje",
        "repetir o harness pelo frontend real do device quando autorizado"
      ]
    },
    {
      "id": "darkosre-rk3326-mali-g31",
      "cfw": {
        "name": "dArkOSRE",
        "version_or_build": "RK3326 clone line (measured 2026-08-27)",
        "origin": "official-image"
      },
      "hardware": {
        "vendor_model": "ArkOS-clone RK3326 handheld",
        "soc": "Rockchip RK3326",
        "gpu_driver": "Mali-G31 (KMSDRM path)",
        "display_compositor": "KMSDRM",
        "resolution": "640x480",
        "orientation": "landscape"
      },
      "runtime": {
        "host_abi": "aarch64",
        "guest_abi": "aarch64 and armv7",
        "libc": "glibc",
        "filesystem_semantics": "exfat roms partition, FAT-like and case-insensitive",
        "ram_free": "unknown"
      },
      "frontend": {
        "name": "EmulationStation (dArkOSRE)",
        "portmaster_version": "unknown",
        "control_mapping_source": "PortMaster control.txt (two-marker CFW detection)"
      },
      "framework_ref": {
        "tag_or_commit": "framework-v3-rc2-20260827@699723e6 + nxgenerator@8d70b241 + nxgl@f721af2c",